{
  "schema_version": "1.0",
  "project_id": "project.vibehub",
  "generated_at": "2026-07-11T08:00:00.000Z",
  "model_version": "model.fixture.1",
  "freshness": "fresh",
  "completeness": "partial",
  "evidence_refs": [
    {
      "evidence_id": "ev.fixture",
      "kind": "test",
      "grade": "hard_observed",
      "label_key": "evidence.fixture.generated",
      "locator": "fixtures/v3/ev.fixture",
      "captured_at": "2026-07-11T08:00:00.000Z"
    }
  ],
  "warnings": [
    {
      "code": "SUBTREE_INACCESSIBLE",
      "severity": "warning",
      "message_key": "warning.subtree_inaccessible",
      "evidence_refs": [
        {
          "evidence_id": "ev.fixture",
          "kind": "test",
          "grade": "hard_observed",
          "label_key": "evidence.fixture.generated",
          "locator": "fixtures/v3/ev.fixture",
          "captured_at": "2026-07-11T08:00:00.000Z"
        }
      ]
    },
    {
      "code": "ANALYZER_UNSUPPORTED",
      "severity": "warning",
      "message_key": "warning.analyzer_unsupported",
      "evidence_refs": [
        {
          "evidence_id": "ev.fixture",
          "kind": "test",
          "grade": "hard_observed",
          "label_key": "evidence.fixture.generated",
          "locator": "fixtures/v3/ev.fixture",
          "captured_at": "2026-07-11T08:00:00.000Z"
        }
      ]
    }
  ],
  "errors": [],
  "task_id": "task.m0",
  "plan_version": 1,
  "graph_state": "valid",
  "nodes": [
    {
      "node_id": "node.contracts",
      "title": "Freeze contracts",
      "goal": "Create M1-ready contracts",
      "state": "active",
      "readiness": "ready",
      "block_reasons": [],
      "scope": [
        "contracts/v3",
        "fixtures/v3"
      ],
      "criterion_ids": [
        "criterion.m0.c07"
      ]
    }
  ],
  "scheduling_edges": [],
  "trace_relations": [],
  "execution": {
    "planned_sessions": 1,
    "observed_sessions": 1,
    "planned_worktrees": 0,
    "observed_worktrees": 0
  }
}
